variable_name,variable_label,avail_from_dt,table_name
LLC_ID,None,2022-01-10 06:17:02.083,ns8_benefits_v0001_20211101
W8BENID,sortkey: benefit payment identifier,2022-01-10 06:17:02.083,ns8_benefits_v0001_20211101
W8BENA,Amount of last payment respondent and spouse/partner received,2022-01-10 06:17:02.083,ns8_benefits_v0001_20211101
W8BENP2,Period covered by last payment respondent and spouse/partner received,2022-01-10 06:17:02.083,ns8_benefits_v0001_20211101
W8BENA3,Other period covered by last payment respondent and spouse/partner received,2022-01-10 06:17:02.083,ns8_benefits_v0001_20211101
W8BENW,DV: Weekly benefit payments,2022-01-10 06:17:02.083,ns8_benefits_v0001_20211101
V3,None,2022-01-10 06:17:02.083,ns8_benefits_v0001_20211101
