variable_name,variable_label,avail_from_dt,table_name
mcs_llc_fid_e,Encrypted Family/Household anonymised ID for LLC,2022-01-02 19:31:05.810,basic_demographic_family_v0001_20211101
GDHTYS00,S7 DV Summary of Parents/Carers in Household,2022-01-02 19:31:05.810,basic_demographic_family_v0001_20211101
GDNUMH00,S7 DV Number of people in HH excluding CMs,2022-01-02 19:31:05.810,basic_demographic_family_v0001_20211101
GDRELP00,S7 DV Relationship between Parents/Carers in Household,2022-01-02 19:31:05.810,basic_demographic_family_v0001_20211101
GDTOTP00,S7 DV Number of people in HH including CMs,2022-01-02 19:31:05.810,basic_demographic_family_v0001_20211101
GDTOTS00,S7 DV Number of sibs in hhold plus CMs,2022-01-02 19:31:05.810,basic_demographic_family_v0001_20211101
GHROMA,Number of rooms of CM accommodation [CM moved away from parent accommodation] [TOP-CODED],2022-01-02 19:31:05.810,basic_demographic_family_v0001_20211101
FOEDE000,S6 DV OECD equiv weekly family income,2022-01-02 19:31:05.810,basic_demographic_family_v0001_20211101
