variable_name,variable_label,avail_from_dt,table_name
EPFCSX1I,Reasons choose sch Feeder schl,2022-01-03 05:54:31.573,mcs5_parent_cm_interview_v0001_20211101
EPFCSX1J,Reasons choose sch No choice,2022-01-03 05:54:31.573,mcs5_parent_cm_interview_v0001_20211101
EPFCSX1K,Reasons choose sch Has a 6th form,2022-01-03 05:54:31.573,mcs5_parent_cm_interview_v0001_20211101
EPFCSX1L,Reasons choose sch Vague ,2022-01-03 05:54:31.573,mcs5_parent_cm_interview_v0001_20211101
EPFCSM00,Most important factor in choosing to request a place at a school,2022-01-03 05:54:31.573,mcs5_parent_cm_interview_v0001_20211101
EPRSTP0A,Steps taken to get CM into school (Moved home) MC1,2022-01-03 05:54:31.573,mcs5_parent_cm_interview_v0001_20211101
EPRSTP0B,Steps taken to get CM into school (Short-term renting) MC2,2022-01-03 05:54:31.573,mcs5_parent_cm_interview_v0001_20211101
EPRSTP0C,Steps taken to get CM into school (Used the address of a relative/frd) MC3,2022-01-03 05:54:31.573,mcs5_parent_cm_interview_v0001_20211101
EPRSTP0D,Steps taken to get CM into school (Got child into a particular school) MC4,2022-01-03 05:54:31.573,mcs5_parent_cm_interview_v0001_20211101
EPRSTP0E,Steps taken to get CM into school (Arranged extra tuition/coaching) MC5,2022-01-03 05:54:31.573,mcs5_parent_cm_interview_v0001_20211101
EPRSTP0F,Steps taken to get CM into school (Arranged for extra curric activities) MC6,2022-01-03 05:54:31.573,mcs5_parent_cm_interview_v0001_20211101
EPRSTP0G,Steps taken to get CM into school (Joined a church/place of worship) MC7,2022-01-03 05:54:31.573,mcs5_parent_cm_interview_v0001_20211101
EPRSTP0H,Steps taken to get CM into school (Asked someone influential to recommend) MC8,2022-01-03 05:54:31.573,mcs5_parent_cm_interview_v0001_20211101
EPRSTP0I,Steps taken to get CM into school (Other steps) MC9,2022-01-03 05:54:31.573,mcs5_parent_cm_interview_v0001_20211101
EPRSTP0J,Steps taken to get CM into school (Dont know) MC10,2022-01-03 05:54:31.573,mcs5_parent_cm_interview_v0001_20211101
EPRSTP0K,Steps taken to get CM into school (Refused) MC11,2022-01-03 05:54:31.573,mcs5_parent_cm_interview_v0001_20211101
EPRSTP0L,Steps taken to get CM into school (No answer) MC12,2022-01-03 05:54:31.573,mcs5_parent_cm_interview_v0001_20211101
EPOTNU00,No of other secondary schools applied for,2022-01-03 05:54:31.573,mcs5_parent_cm_interview_v0001_20211101
EPTYSC0A,Which schools applied to Comprehensive,2022-01-03 05:54:31.573,mcs5_parent_cm_interview_v0001_20211101
EPTYSC0B,Which schools applied to Academy,2022-01-03 05:54:31.573,mcs5_parent_cm_interview_v0001_20211101
EPTYSC0C,Which schools applied to Free school,2022-01-03 05:54:31.573,mcs5_parent_cm_interview_v0001_20211101
EPTYSC0D,Which schools applied to Grammar school,2022-01-03 05:54:31.573,mcs5_parent_cm_interview_v0001_20211101
EPTYSC0E,Which schools applied to Faith  voluntary aided or voluntary controlled school,2022-01-03 05:54:31.573,mcs5_parent_cm_interview_v0001_20211101
EPTYSC0F,Which schools applied to Independent,2022-01-03 05:54:31.573,mcs5_parent_cm_interview_v0001_20211101
EPTYSC0G,Which schools applied to Special school,2022-01-03 05:54:31.573,mcs5_parent_cm_interview_v0001_20211101
EPTYSC0H,Which schools applied to Other type of school,2022-01-03 05:54:31.573,mcs5_parent_cm_interview_v0001_20211101
EPTYSC0I,Which schools applied to Dont know,2022-01-03 05:54:31.573,mcs5_parent_cm_interview_v0001_20211101
EPTYSC0J,Which schools applied to Refused,2022-01-03 05:54:31.573,mcs5_parent_cm_interview_v0001_20211101
EPTYSO0A,(SWNI) Schools applied for (Comprehensive non-selective state school),2022-01-03 05:54:31.573,mcs5_parent_cm_interview_v0001_20211101
EPTYSO0B,(SWNI) Schools applied for (Grammar school),2022-01-03 05:54:31.573,mcs5_parent_cm_interview_v0001_20211101
EPTYSO0C,(SWNI) Schools applied for (Faith voluntary aided),2022-01-03 05:54:31.573,mcs5_parent_cm_interview_v0001_20211101
EPTYSO0D,(SWNI) Schools applied for (Independent,2022-01-03 05:54:31.573,mcs5_parent_cm_interview_v0001_20211101
EPTYSO0E,(SWNI) Schools applied for (Special school),2022-01-03 05:54:31.573,mcs5_parent_cm_interview_v0001_20211101
EPTYSO0F,(SWNI) Schools applied for  (Other type of school),2022-01-03 05:54:31.573,mcs5_parent_cm_interview_v0001_20211101
EPTYSO0G,(SWNI) Schools applied for (Dont know),2022-01-03 05:54:31.573,mcs5_parent_cm_interview_v0001_20211101
EPTYSO0H,(SWNI) Schools applied for (Refused),2022-01-03 05:54:31.573,mcs5_parent_cm_interview_v0001_20211101
EPSSAT00,how much is CM looking forward to secondary school,2022-01-03 05:54:31.573,mcs5_parent_cm_interview_v0001_20211101
EPSSCP00,How easy or difficult do you think CM will find moving to secondary school,2022-01-03 05:54:31.573,mcs5_parent_cm_interview_v0001_20211101
EPHOLS00,How many times been on holiday outside UK,2022-01-03 05:54:31.573,mcs5_parent_cm_interview_v0001_20211101
EPLIBR00,How often CM visited library,2022-01-03 05:54:31.573,mcs5_parent_cm_interview_v0001_20211101
EPRELI00,How often CM attended religious service,2022-01-03 05:54:31.573,mcs5_parent_cm_interview_v0001_20211101
EPMUSC00,Does CM play a musical instrument,2022-01-03 05:54:31.573,mcs5_parent_cm_interview_v0001_20211101
EPMUSL00,Do you pay for CM's lessons for a musical instrument,2022-01-03 05:54:31.573,mcs5_parent_cm_interview_v0001_20211101
EPSEHO00,Days per week CM does sport/exercise,2022-01-03 05:54:31.573,mcs5_parent_cm_interview_v0001_20211101
EPPLFR00,Frequency of non club/class physical activities,2022-01-03 05:54:31.573,mcs5_parent_cm_interview_v0001_20211101
EPCYCF00,How often does CM use a bicycle,2022-01-03 05:54:31.573,mcs5_parent_cm_interview_v0001_20211101
EPCYCT00,Has CM has any formal cycle training,2022-01-03 05:54:31.573,mcs5_parent_cm_interview_v0001_20211101
EPVIFR00,How often CM spends time with friends outside school,2022-01-03 05:54:31.573,mcs5_parent_cm_interview_v0001_20211101
EPLCLF00,Does CM makes journeys on foot (outside of school),2022-01-03 05:54:31.573,mcs5_parent_cm_interview_v0001_20211101
EPLCLB00,Does CM makes journeys on bike (outside of school),2022-01-03 05:54:31.573,mcs5_parent_cm_interview_v0001_20211101
EPLCLP00,Does CM makes journeys on public transport (outside of school),2022-01-03 05:54:31.573,mcs5_parent_cm_interview_v0001_20211101
EPPLWE00,Do you allow unsupervised time outside home with friends (at w/es),2022-01-03 05:54:31.573,mcs5_parent_cm_interview_v0001_20211101
EPPLWK00,Do you allow unsupervised time outside home with friends,2022-01-03 05:54:31.573,mcs5_parent_cm_interview_v0001_20211101
EPPLWY0A,Why dont allow unsupervised o-s home w friends (Child not old enough),2022-01-03 05:54:31.573,mcs5_parent_cm_interview_v0001_20211101
EPPLWY0B,Why dont allow unsupervised o-s home w friends (Child not mature enough),2022-01-03 05:54:31.573,mcs5_parent_cm_interview_v0001_20211101
EPPLWY0C,Why dont allow unsupervised o-s home w friends (Danger from traffic),2022-01-03 05:54:31.573,mcs5_parent_cm_interview_v0001_20211101
EPPLWY0D,Why dont allow unsupervised o-s home w friends (Child has to do homework),2022-01-03 05:54:31.573,mcs5_parent_cm_interview_v0001_20211101
EPPLWY0E,Why dont allow unsupervised o-s home w friends (Child has other things to do),2022-01-03 05:54:31.573,mcs5_parent_cm_interview_v0001_20211101
EPPLWY0F,Why dont allow unsupervised o-s home w friends (Child no friends nearby),2022-01-03 05:54:31.573,mcs5_parent_cm_interview_v0001_20211101
EPPLWY0G,Why dont allow unsupervised o-s home w friends (Danger from adults),2022-01-03 05:54:31.573,mcs5_parent_cm_interview_v0001_20211101
EPPLWY0H,Why dont allow unsupervised o-s home w friends (Danger of bullying or assault),2022-01-03 05:54:31.573,mcs5_parent_cm_interview_v0001_20211101
EPPLWY0I,Why dont allow unsupervised o-s home w friends (Other concns over chld safety),2022-01-03 05:54:31.573,mcs5_parent_cm_interview_v0001_20211101
EPPLWY0J,Why dont allow unsupervised o-s home w friends (Child doesnt want to),2022-01-03 05:54:31.573,mcs5_parent_cm_interview_v0001_20211101
EPCLSX0G,Affected by Mental health (A),2022-01-03 05:54:31.573,mcs5_parent_cm_interview_v0001_20211101
EPCLSX0H,Affected by Stamina or breathing or fatigue (A),2022-01-03 05:54:31.573,mcs5_parent_cm_interview_v0001_20211101
EPCLSX0I,Affected by Social or behavioural cond (eg associated with autism ADHD) (A),2022-01-03 05:54:31.573,mcs5_parent_cm_interview_v0001_20211101
EPCLSX0J,Affected by Other mention of condition or illness (A),2022-01-03 05:54:31.573,mcs5_parent_cm_interview_v0001_20211101
EPCLSX0K,Affected by Balance or dizzy or vertigo (A),2022-01-03 05:54:31.573,mcs5_parent_cm_interview_v0001_20211101
EPCLSX0L,Affected by Dietary issues or strict diet or food intolrnce or coeliac (A),2022-01-03 05:54:31.573,mcs5_parent_cm_interview_v0001_20211101
EPCLSX0M,Affected by Forbidden to drive (A),2022-01-03 05:54:31.573,mcs5_parent_cm_interview_v0001_20211101
EPCLSX0N,Affected by Sleeporsleep apoeniaordeprivation (A),2022-01-03 05:54:31.573,mcs5_parent_cm_interview_v0001_20211101
EPCLSX0O,Affected by Sloworto mobilise or underactive (A),2022-01-03 05:54:31.573,mcs5_parent_cm_interview_v0001_20211101
EPCLSX0P,Affected by Speech or communication problems (A),2022-01-03 05:54:31.573,mcs5_parent_cm_interview_v0001_20211101
EPCLSX0Q,Affected by Vulnerable to infection (eg colds) (A),2022-01-03 05:54:31.573,mcs5_parent_cm_interview_v0001_20211101
EPCLSX0R,Affected by None or not affected or Use this code when cond is under cntrl (A),2022-01-03 05:54:31.573,mcs5_parent_cm_interview_v0001_20211101
EPCLSX0S,Affected by Allergies(NOT food intolerances see dietry) (A),2022-01-03 05:54:31.573,mcs5_parent_cm_interview_v0001_20211101
EPCLSX0T,Affected by Alopecia (A),2022-01-03 05:54:31.573,mcs5_parent_cm_interview_v0001_20211101
EPCLSX0U,Affected by Anaemia (A),2022-01-03 05:54:31.573,mcs5_parent_cm_interview_v0001_20211101
EPCLSX0V,Affected by Anxiety or panic attacks or stress (A),2022-01-03 05:54:31.573,mcs5_parent_cm_interview_v0001_20211101
EPCLSX0W,Affected by Arthritis or fibromyalgia or spondylitis or prblms with joints (A),2022-01-03 05:54:31.573,mcs5_parent_cm_interview_v0001_20211101
EPCLSX0X,Affected by Asthma (A),2022-01-03 05:54:31.573,mcs5_parent_cm_interview_v0001_20211101
EPCLSX0Y,Affected by Back or vertibrae problems or scholiosis (A),2022-01-03 05:54:31.573,mcs5_parent_cm_interview_v0001_20211101
EPCLSX0Z,Affected by Bladder problems or urine issues or incontinence (A),2022-01-03 05:54:31.573,mcs5_parent_cm_interview_v0001_20211101
EPCLSX1A,Affected by Blood disorder eg clots or haemophilia or ITP (A),2022-01-03 05:54:31.573,mcs5_parent_cm_interview_v0001_20211101
EPCLSX1B,Affected by Blood pressure issues or hypertension (A),2022-01-03 05:54:31.573,mcs5_parent_cm_interview_v0001_20211101
EPCLSX1C,Affected by Bowel or colon prblms or IBS or Crohns or colitis or constiptn (A),2022-01-03 05:54:31.573,mcs5_parent_cm_interview_v0001_20211101
EPCLSX1D,Affected by Bone issues or brittle or soft or damage to bones (A),2022-01-03 05:54:31.573,mcs5_parent_cm_interview_v0001_20211101
EPCLSX1E,Affected by Cancer (all mentions) (A),2022-01-03 05:54:31.573,mcs5_parent_cm_interview_v0001_20211101
EPCLSX1F,Affected by Cerebral palsy (A),2022-01-03 05:54:31.573,mcs5_parent_cm_interview_v0001_20211101
EPCLSX1G,Affected by Circ problems or numb or tingling  fingers or toes or Raynauds (A),2022-01-03 05:54:31.573,mcs5_parent_cm_interview_v0001_20211101
EPCLSX1H,Affected by Diabetes (A),2022-01-03 05:54:31.573,mcs5_parent_cm_interview_v0001_20211101
EPCLSX1I,Affected by Digestive problems (A),2022-01-03 05:54:31.573,mcs5_parent_cm_interview_v0001_20211101
EPCLSX1J,Affected by Dyslexia (A),2022-01-03 05:54:31.573,mcs5_parent_cm_interview_v0001_20211101
EPCLSX1K,Affected by Eating or weight disorders or problems (A),2022-01-03 05:54:31.573,mcs5_parent_cm_interview_v0001_20211101
EPCLSX1L,Affected by Epilepsy or seizures (A),2022-01-03 05:54:31.573,mcs5_parent_cm_interview_v0001_20211101
EPCLSX1M,Affected by Growing or deficiency or growing too fast (A),2022-01-03 05:54:31.573,mcs5_parent_cm_interview_v0001_20211101
EPCLSX1N,Affected by Gynaelogical problems (A),2022-01-03 05:54:31.573,mcs5_parent_cm_interview_v0001_20211101
EPCLSX1O,Affected by Hand or wrist or arm problems (eg carpal tunnel) (A),2022-01-03 05:54:31.573,mcs5_parent_cm_interview_v0001_20211101
EPCLSX1P,Affected by Head or face or mouth or teeth problems (A),2022-01-03 05:54:31.573,mcs5_parent_cm_interview_v0001_20211101
EPCLSX1Q,Affected by Heart prblms (eg Angina or arrhyth or crdiomyopthy or pacemkr) (A),2022-01-03 05:54:31.573,mcs5_parent_cm_interview_v0001_20211101
EPCLSX1R,Affected by Hernia (A),2022-01-03 05:54:31.573,mcs5_parent_cm_interview_v0001_20211101
EPCLSX1S,Affected by High cholesterol (A),2022-01-03 05:54:31.573,mcs5_parent_cm_interview_v0001_20211101
EPCLSX1T,Affected by Hormonal prblms or imbalace of hormns or having horm treatment (A),2022-01-03 05:54:31.573,mcs5_parent_cm_interview_v0001_20211101
EPCLSX1U,Affected by Immune system issues or deficiency of vitamins (A),2022-01-03 05:54:31.573,mcs5_parent_cm_interview_v0001_20211101
EPCLSX1V,Affected by Jaw complaints (A),2022-01-03 05:54:31.573,mcs5_parent_cm_interview_v0001_20211101
EPCLSX1W,Affected by Kidney problems (A),2022-01-03 05:54:31.573,mcs5_parent_cm_interview_v0001_20211101
EPCLSX1X,Affected by Leg or foot or knee issues (eg Osgood schlatters) (A),2022-01-03 05:54:31.573,mcs5_parent_cm_interview_v0001_20211101
EPCLSX1Y,Affected by Liver problems (A),2022-01-03 05:54:31.573,mcs5_parent_cm_interview_v0001_20211101
EPCLSX1Z,Affected by Migraine or headaches (A),2022-01-03 05:54:31.573,mcs5_parent_cm_interview_v0001_20211101
EPCLSX2C,Affected by Neck or shoulder issues (A),2022-01-03 05:54:31.573,mcs5_parent_cm_interview_v0001_20211101
EPCLSX2D,Affected by Neurological disorders or dyspraxia or peripheral neuropathy (A),2022-01-03 05:54:31.573,mcs5_parent_cm_interview_v0001_20211101
EPCLSX2E,Affected by Pain or Lots of pain or affects pain levels nsf (A),2022-01-03 05:54:31.573,mcs5_parent_cm_interview_v0001_20211101
EPCLSX2F,Affected by Skin problems(eg eczema or psoriasis or urticaris or vitiligo) (A),2022-01-03 05:54:31.573,mcs5_parent_cm_interview_v0001_20211101
EPCLSX2G,Affected by Stomach issues or stomach ulcer (A),2022-01-03 05:54:31.573,mcs5_parent_cm_interview_v0001_20211101
EPCLSL00,Do CM illnesses limit activity,2022-01-03 05:54:31.573,mcs5_parent_cm_interview_v0001_20211101
EPCLSP00,For how long has CM's ability been reduced,2022-01-03 05:54:31.573,mcs5_parent_cm_interview_v0001_20211101
EPEYEXAB,Had treatment for a patch (A) R1,2022-01-03 05:54:31.573,mcs5_parent_cm_interview_v0001_20211101
EPEYEXAC,Had treatment for glasses (A) R1,2022-01-03 05:54:31.573,mcs5_parent_cm_interview_v0001_20211101
EPEYEXAD,Had treatment for Other (A) R1,2022-01-03 05:54:31.573,mcs5_parent_cm_interview_v0001_20211101
EPEYEXAE,Had treatment for SPONTAN: Waiting for appointment/referral,2022-01-03 05:54:31.573,mcs5_parent_cm_interview_v0001_20211101
EPEYEXAF,Had treatment for None or nothing (A) R1,2022-01-03 05:54:31.573,mcs5_parent_cm_interview_v0001_20211101
EPEYEXAG,Had treatment for Refused (A) R1,2022-01-03 05:54:31.573,mcs5_parent_cm_interview_v0001_20211101
EPEYEXAH,Had treatment for Dont know (A) R1,2022-01-03 05:54:31.573,mcs5_parent_cm_interview_v0001_20211101
EPEYEXAI,Had treatment for Eye drops (A) R1,2022-01-03 05:54:31.573,mcs5_parent_cm_interview_v0001_20211101
EPEYEXAJ,Had treatment for Antibiotics (incl. creams,2022-01-03 05:54:31.573,mcs5_parent_cm_interview_v0001_20211101
EPACWX1F,Most server accident/indury (A) [Grazes or scrapes - no mention],2022-01-03 05:54:31.573,mcs5_parent_cm_interview_v0001_20211101
EPACWX1G,Most server accident/indury (A) [Injury to ear or infection],2022-01-03 05:54:31.573,mcs5_parent_cm_interview_v0001_20211101
EPACWX1H,Most server accident/indury (A) [Injury to groin area or test],2022-01-03 05:54:31.573,mcs5_parent_cm_interview_v0001_20211101
EPACWX1I,Most server accident/indury (A) [Swallowed something or bone],2022-01-03 05:54:31.573,mcs5_parent_cm_interview_v0001_20211101
EPACWX1J,Most server accident/indury (A) [Sporting injury - no more sp],2022-01-03 05:54:31.573,mcs5_parent_cm_interview_v0001_20211101
EPACWX1K,Most server accident/indury (A) [Vague or irrelevant answer],2022-01-03 05:54:31.573,mcs5_parent_cm_interview_v0001_20211101
EPACCH00,Whether CM went to hospital due to accident,2022-01-03 05:54:31.573,mcs5_parent_cm_interview_v0001_20211101
EPADMA00,Number of hospital admissions to hospital for health problems (since last IW),2022-01-03 05:54:31.573,mcs5_parent_cm_interview_v0001_20211101
EPMEDS00,CM taking regular medication,2022-01-03 05:54:31.573,mcs5_parent_cm_interview_v0001_20211101
EPMPNLA0,Whether label consulted R1,2022-01-03 05:54:31.573,mcs5_parent_cm_interview_v0001_20211101
EPMPNMA0,CM taking any other medication R1,2022-01-03 05:54:31.573,mcs5_parent_cm_interview_v0001_20211101
EPMPNLB0,Whether label consulted R2,2022-01-03 05:54:31.573,mcs5_parent_cm_interview_v0001_20211101
EPMPNMB0,CM taking any other medication R2,2022-01-03 05:54:31.573,mcs5_parent_cm_interview_v0001_20211101
EPMPNLC0,Whether label consulted R3,2022-01-03 05:54:31.573,mcs5_parent_cm_interview_v0001_20211101
EPMPNMC0,CM taking any other medication R3,2022-01-03 05:54:31.573,mcs5_parent_cm_interview_v0001_20211101
EPMPNLD0,Whether label consulted R4,2022-01-03 05:54:31.573,mcs5_parent_cm_interview_v0001_20211101
EPMPNMD0,CM taking any other medication R4,2022-01-03 05:54:31.573,mcs5_parent_cm_interview_v0001_20211101
EPMPNLE0,Whether label consulted R5,2022-01-03 05:54:31.573,mcs5_parent_cm_interview_v0001_20211101
EPMPNME0,CM taking any other medication R5,2022-01-03 05:54:31.573,mcs5_parent_cm_interview_v0001_20211101
EPMPNLF0,Whether label consulted R6,2022-01-03 05:54:31.573,mcs5_parent_cm_interview_v0001_20211101
EPMPNMF0,CM taking any other medication R6,2022-01-03 05:54:31.573,mcs5_parent_cm_interview_v0001_20211101
EPBRKN00,Days per week CM eats breakfast,2022-01-03 05:54:31.573,mcs5_parent_cm_interview_v0001_20211101
EPSCHD00,Usually has midday meal provided by school,2022-01-03 05:54:31.573,mcs5_parent_cm_interview_v0001_20211101
EPFREM00,Whether school meals paid for or free,2022-01-03 05:54:31.573,mcs5_parent_cm_interview_v0001_20211101
EPELFR00,Is CM eligible to have a midday meal provided fr,2022-01-03 05:54:31.573,mcs5_parent_cm_interview_v0001_20211101
EPSWTD00,How often does CM drink sweetened drinks,2022-01-03 05:54:31.573,mcs5_parent_cm_interview_v0001_20211101
EPASWD00,How often does CM drink artifically sweetened drinks,2022-01-03 05:54:31.573,mcs5_parent_cm_interview_v0001_20211101
EPFRTP00,How many portions of fruit per day,2022-01-03 05:54:31.573,mcs5_parent_cm_interview_v0001_20211101
EPVRFD00,Does CM have a variety of foods,2022-01-03 05:54:31.573,mcs5_parent_cm_interview_v0001_20211101
EPAPPF00,What is CM's appetite like,2022-01-03 05:54:31.573,mcs5_parent_cm_interview_v0001_20211101
EPEYSZ0A_TR,Eye problem R1 (ICD10) truncated,2022-01-03 05:54:31.573,mcs5_parent_cm_interview_v0001_20211101
EPEYSZ0B_TR,Eye problem R2 (ICD10) truncated,2022-01-03 05:54:31.573,mcs5_parent_cm_interview_v0001_20211101
EPEYSZ0C_TR,Eye problem R3 (ICD10) truncated,2022-01-03 05:54:31.573,mcs5_parent_cm_interview_v0001_20211101
EPHRPX0A_TR,Hearing problems (ICD10 code) R1 truncated,2022-01-03 05:54:31.573,mcs5_parent_cm_interview_v0001_20211101
EPHRPX0B_TR,Hearing problems (ICD10 code) R2 truncated,2022-01-03 05:54:31.573,mcs5_parent_cm_interview_v0001_20211101
EPHRPX0C_TR,Hearing problems (ICD10 code) R3 truncated,2022-01-03 05:54:31.573,mcs5_parent_cm_interview_v0001_20211101
EPBROW00,CM has own bedroom?,2022-01-03 05:54:31.573,mcs5_parent_cm_interview_v0001_20211101
EPQTRM00,Quiet area where CM is able to do homework,2022-01-03 05:54:31.573,mcs5_parent_cm_interview_v0001_20211101
EPPLOG00,Are there any parks,2022-01-03 05:54:31.573,mcs5_parent_cm_interview_v0001_20211101
EPWPRX1K,Why send to fee-paying school Our own choice,2022-01-03 05:54:31.573,mcs5_parent_cm_interview_v0001_20211101
EPWPRX1L,Why send to fee-paying schl Respondent Parent had  private,2022-01-03 05:54:31.573,mcs5_parent_cm_interview_v0001_20211101
EPWPRX1M,Why send to fee-paying school Respondant can afford it,2022-01-03 05:54:31.573,mcs5_parent_cm_interview_v0001_20211101
EPWPRX1N,Why send to fee-paying school Child is bright,2022-01-03 05:54:31.573,mcs5_parent_cm_interview_v0001_20211101
EPWPRX1O,Why send to fee-paying school Other (A),2022-01-03 05:54:31.573,mcs5_parent_cm_interview_v0001_20211101
EPWPRX1P,Why send to fee-paying school Vague,2022-01-03 05:54:31.573,mcs5_parent_cm_interview_v0001_20211101
EPSCS200,Single sex or mixed school,2022-01-03 05:54:31.573,mcs5_parent_cm_interview_v0001_20211101
EPFTH200,CM in school with a particular faith or religion,2022-01-03 05:54:31.573,mcs5_parent_cm_interview_v0001_20211101
EPFHD200,Did you provide evidence of faith to school,2022-01-03 05:54:31.573,mcs5_parent_cm_interview_v0001_20211101
EPFCHO00,Was this your first choice secondary school?,2022-01-03 05:54:31.573,mcs5_parent_cm_interview_v0001_20211101
EPREQP00,Postcode of Requested school,2022-01-03 05:54:31.573,mcs5_parent_cm_interview_v0001_20211101
EPREPQ00,Have you requested a place at a particular secondary school for CM,2022-01-03 05:54:31.573,mcs5_parent_cm_interview_v0001_20211101
EPINC300,School details (text) correct,2022-01-03 05:54:31.573,mcs5_parent_cm_interview_v0001_20211101
EPFCSC0A,Imp factors in choice of school - A - Child wanted to go there,2022-01-03 05:54:31.573,mcs5_parent_cm_interview_v0001_20211101
EPFCSC0B,Imp factors in choice of school - B - Schl near to home,2022-01-03 05:54:31.573,mcs5_parent_cm_interview_v0001_20211101
EPFCSC0C,Imp factors in choice of school - C - CMs frds go there,2022-01-03 05:54:31.573,mcs5_parent_cm_interview_v0001_20211101
EPFCSC0D,Imp factors in choice of school - D - CMs siblings go there,2022-01-03 05:54:31.573,mcs5_parent_cm_interview_v0001_20211101
EPFCSC0E,Imp factors in choice of school - E - Oth relative go there,2022-01-03 05:54:31.573,mcs5_parent_cm_interview_v0001_20211101
EPFCSC0F,Imp factors in choice of school - F - Schl s academic reputation,2022-01-03 05:54:31.573,mcs5_parent_cm_interview_v0001_20211101
EPFCSC0G,Imp factors in choice of school - G - Schl s anti-bullying/discipline policy,2022-01-03 05:54:31.573,mcs5_parent_cm_interview_v0001_20211101
EPFCSC0H,Imp factors in choice of school - H - Schl s good extra-curricular activities,2022-01-03 05:54:31.573,mcs5_parent_cm_interview_v0001_20211101
EPFCSC0I,Imp factors in choice of school - I - Schl s specialist curriculum,2022-01-03 05:54:31.573,mcs5_parent_cm_interview_v0001_20211101
EPFCSC0J,Imp factors in choice of school - J - Schl has good facilities,2022-01-03 05:54:31.573,mcs5_parent_cm_interview_v0001_20211101
EPFCSC0K,Imp factors in choice of school - K - Genearl good impression of Schl,2022-01-03 05:54:31.573,mcs5_parent_cm_interview_v0001_20211101
EPFCSC0L,Imp factors in choice of school - L - Religious grounds,2022-01-03 05:54:31.573,mcs5_parent_cm_interview_v0001_20211101
EPFCSC0M,Imp factors in choice of school - M - Other reasons,2022-01-03 05:54:31.573,mcs5_parent_cm_interview_v0001_20211101
EPFCSC0N,Imp factors in choice of school - Don t know,2022-01-03 05:54:31.573,mcs5_parent_cm_interview_v0001_20211101
EPFCSC0O,Imp factors in choice of school - Refused,2022-01-03 05:54:31.573,mcs5_parent_cm_interview_v0001_20211101
EPFCSX0A,Reasons choose sch A - Child wanted to go there (A),2022-01-03 05:54:31.573,mcs5_parent_cm_interview_v0001_20211101
EPFCSX0B,Reasons choose sch B - School is near or nearest to home (A),2022-01-03 05:54:31.573,mcs5_parent_cm_interview_v0001_20211101
EPFCSX0C,Reasons choose sch C - His,2022-01-03 05:54:31.573,mcs5_parent_cm_interview_v0001_20211101
EPFCSX0D,Reasons choose sch D - His,2022-01-03 05:54:31.573,mcs5_parent_cm_interview_v0001_20211101
EPFCSX0E,Reasons choose sch E - Other relative,2022-01-03 05:54:31.573,mcs5_parent_cm_interview_v0001_20211101
EPFCSX0F,Reasons choose sch F - School has good exam results,2022-01-03 05:54:31.573,mcs5_parent_cm_interview_v0001_20211101
EPFCSX0G,Reasons choose sch G - School has strong anti-bullying,2022-01-03 05:54:31.573,mcs5_parent_cm_interview_v0001_20211101
EPFCSX0H,Reasons choose sch H - School offers good range of extra-curr activities (A),2022-01-03 05:54:31.573,mcs5_parent_cm_interview_v0001_20211101
EPFCSX0I,Reasons choose sch I - Wanted CM to go to school with speclst curric (A),2022-01-03 05:54:31.573,mcs5_parent_cm_interview_v0001_20211101
EPFCSX0J,Reasons choose sch J - School has good facilities (A),2022-01-03 05:54:31.573,mcs5_parent_cm_interview_v0001_20211101
EPFCSX0K,Reasons choose sch K - General good impression of school (A),2022-01-03 05:54:31.573,mcs5_parent_cm_interview_v0001_20211101
EPFCSX0L,Reasons choose sch L - Religious grounds (A),2022-01-03 05:54:31.573,mcs5_parent_cm_interview_v0001_20211101
EPFCSX0M,Reasons choose sch Other (A),2022-01-03 05:54:31.573,mcs5_parent_cm_interview_v0001_20211101
EPFCSX0N,Reasons choose sch Dont know (A),2022-01-03 05:54:31.573,mcs5_parent_cm_interview_v0001_20211101
EPFCSX0O,Reasons choose sch Refused (A),2022-01-03 05:54:31.573,mcs5_parent_cm_interview_v0001_20211101
EPFCSX0P,Reasons choose sch Good school - for specific reasons not elsewhere spec (A),2022-01-03 05:54:31.573,mcs5_parent_cm_interview_v0001_20211101
EPFCSX0Q,Reasons choose sch Did not like previous,2022-01-03 05:54:31.573,mcs5_parent_cm_interview_v0001_20211101
EPFCSX0R,Reasons choose sch Connections (incl family) with school (A),2022-01-03 05:54:31.573,mcs5_parent_cm_interview_v0001_20211101
EPFCSX0S,Reasons choose sch Convenient location incl close to childcare (A),2022-01-03 05:54:31.573,mcs5_parent_cm_interview_v0001_20211101
EPFCSX0T,Reasons choose sch Want CM to go to a diff schl to frnd(s)  (A),2022-01-03 05:54:31.573,mcs5_parent_cm_interview_v0001_20211101
